{
  "admission_state": "ADMIT",
  "admitted_loss_minor": 450000,
  "assessed_loss_minor": 450000,
  "authority_count": 1,
  "authority_manifest_id": "slang_claims_authority_manifest_sha256:ef2f94ce9bfcc1e7bd612a2523076fe30ca9120521a11d6dd4baab6d5cf3c404",
  "bundle_id": "slang_claims_bundle_sha256:a097606af9b4ddea34249e95b408ee1189724501ec04f67fee869b36a9e02b98",
  "canonical_input_id": "slang_claims_canonical_input_sha256:5ff093b27e262f4dd3d947f08609e3958b4f9658bebfe69169f66a58084e52b1",
  "canonicalization_id": "SLANG-CANONICAL-JSON-1-D02",
  "claim_amount_minor": 500000,
  "claim_outcome": "PAYABLE",
  "claim_ref": "CLAIM-ALPHA",
  "claimant_identity_verification": "NOT_ESTABLISHED_BY_REFERENCE_PROFILE",
  "claimant_ref": "CLAIMANT-ALPHA",
  "context_id": "slang_claims_context_sha256:5b036c34370c9936cb9b7e2318563e4ad3f39283c42c153fed41bbc45a6a5f7b",
  "contract_id": "slang_claims_contract_sha256:dcc9fe86df0ded6930fe7c4116ba0f22e43220605d6a0bfd96b75c44f5f19d9a",
  "core_version": "SLANG-CORE-1-D05",
  "currency": "USD",
  "deductible_minor": 100000,
  "evaluation_evidence_id": "slang_claims_evaluation_evidence_sha256:d2db17f1a24170d96e73e9d87ad1b2859145f663dffdd0cfaf797eb206ad0894",
  "evaluation_id": "CLAIM-EVALUATION-001",
  "evidence_agreement_id": "slang_claims_evidence_agreement_sha256:e570ffc786fa232a420ad8cfeb4ab4c22f8c28dae468a9a6454605da266a6a3e",
  "evidence_mode": "SINGLE_AUTHORITY",
  "evidence_set_id": "slang_claims_evidence_set_sha256:739a43993c0d8b72547cb78991cb03f69efb0f451b277231a60ee4a686206dfe",
  "fraud_determination_authority": "NONE",
  "identity_domain_id": "slang_claims_identity_domain_sha256:849c01acebc72403093ffa5e6878136d06a33cbb96ae2ab82827ec91e9cb999e",
  "legal_authority": "NONE",
  "loss_event_ref": "LOSS-EVENT-ALPHA",
  "money_movement": "NONE",
  "outcome_id": "slang_claims_outcome_sha256:ac36b68fff7a7f55ff99cc4b747b59d311b14cf6c6c115c126bbe1645f062dd1",
  "outcome_visible": true,
  "payable_amount_minor": 350000,
  "payment_authority": "NONE",
  "policy_interpretation_authority": "NONE",
  "policy_ref": "POLICY-ALPHA",
  "post_deductible_minor": 350000,
  "profile_id": "SLANG-CLAIMS-PROFILE-1-D03",
  "reason_codes": [
    "CLAIM_PAYABILITY_ADMITTED"
  ],
  "receipt_id": "slang_claims_receipt_sha256:301871eb766172a1f5e56c60941873fe32850f2850d04f5fe1feec0210c472e5",
  "remaining_limit_minor": 1000000,
  "resolution_state": "RESOLVED",
  "result_id": "slang_claims_result_sha256:71641ffa2940f1ee5c9498402d357edb56cb8030facd091da07fa508d9558cce",
  "rule_profile_id": "slang_claims_rule_profile_sha256:a041dcc044c88fa7d05e3828829dda4c85a90882ee2771dfe45576a22a6af629",
  "ruleset_id": "SLANG-CLAIMS-RULESET-1-D03",
  "schema": "SLANG-CLAIMS-RECEIPT-1",
  "settlement_authority": "NONE",
  "source_authenticity": "NOT_ESTABLISHED_BY_REFERENCE_PROFILE",
  "state": "RESOLVED",
  "submission_id": "slang_claims_submission_sha256:5ff093b27e262f4dd3d947f08609e3958b4f9658bebfe69169f66a58084e52b1",
  "version": "0.2.1",
  "visibility_state": "VISIBLE"
}
